{
  "id": "REQ-X-3",
  "type": "requirement",
  "statement": "The export MUST list every item.",
  "status": "draft",
  "source": {
    "file": "SPEC.md",
    "line": 1,
    "commit": "57f7975"
  },
  "verification_method": "inspection",
  "links": {
    "implemented-by": ["57f7975", "packages/core/src/export.ts"],
    "verified-by": ["CHK-1"],
    "evidenced-by": ["EV-1"]
  }
}
